<?xml version="1.0" encoding="UTF-8"?>
<notas xmlns:xsi="http://www.w3.org/2001/XMLSchema-instance" xsi:noNamespaceSchemaLocation="notas.xsd"> <!-- Cualquier elemento con atributos es complejo (uno que contenga a otro) -->
    <nota id="nota_1">
        <a>Juan</a>
        <cuerpo>¡Recuerda que tenemos reunión!</cuerpo>
        <de>Susana</de>
        <cabecera>Recordatorio</cabecera>
        <edad anyo="40">1982</edad>
        <enviado/>
    </nota>
    <nota id="nota_2">
        <fin>Hola Juan</fin>
        <a>Susana</a>
        <de>Juan</de>
        <cabecera>Recordatorio</cabecera>
        <cuerpo>Ok. Muchas Gracias</cuerpo>
        <edad anyo="40">1981</edad>
    </nota>
</notas>